{
  "type": "object",
  "required": [
    "operation_id",
    "idempotency_key",
    "novel_id",
    "base_revision_id",
    "expected_head_hash",
    "type",
    "payload"
  ],
  "properties": {
    "operation_id": {
      "type": "string",
      "pattern": "^op_[0-9a-f]{8}-[0-9a-f]{4}-7[0-9a-f]{3}-[89ab][0-9a-f]{3}-[0-9a-f]{12}$"
    },
    "idempotency_key": {
      "type": "string",
      "minLength": 1,
      "maxLength": 200
    },
    "novel_id": {
      "type": "string",
      "pattern": "^nov_[A-Za-z0-9]{5}$"
    },
    "base_revision_id": {
      "type": "string",
      "pattern": "^rev_[A-Za-z0-9]{5}$"
    },
    "expected_head_hash": {
      "type": "string",
      "pattern": "^sha256:[0-9a-f]{64}$"
    },
    "type": {
      "const": "insert_blocks"
    },
    "payload": {
      "$ref": "InsertBlocksPayload.schema.json"
    }
  },
  "additionalProperties": false,
  "$schema": "https://json-schema.org/draft/2020-12/schema",
  "$id": "https://storyblock.local/plugin/dtos/InsertBlocksOperation.schema.json",
  "title": "InsertBlocksOperation",
  "description": "Code-derived StoryBlock Insert Blocks Operation JSON contract.",
  "x-confidence": "confirmed-from-code",
  "x-source": [
    "server/src/main/java/dev/storyblock/api/http/PreviewController.java",
    "server/src/main/java/dev/storyblock/api/http/CommitController.java",
    "modules/contracts/src/main/java/dev/storyblock/contracts/EditOperationCanonicalMapper.java",
    "modules/domain/src/main/java/dev/storyblock/domain/EditOperation.java"
  ],
  "examples": [
    {
      "operation_id": "op_018f0f5e-7b4a-7c00-8000-000000000001",
      "idempotency_key": "example-1",
      "novel_id": "nov_EUubI",
      "base_revision_id": "rev_mG1Ct",
      "expected_head_hash": "sha256:aaaaaaaaaaaaaaaaaaaaaaaaaaaaaaaaaaaaaaaaaaaaaaaaaaaaaaaaaaaaaaaa",
      "type": "insert_blocks",
      "payload": {
        "insertion_point": {
          "scene_id": "scn_UX5V4",
          "position": "start"
        },
        "blocks": [
          {
            "id": "blk_49pHt",
            "text": "春風到了。",
            "meta": {
            }
          }
        ]
      }
    }
  ]
}
