{
  "operation_id": "op_018f0f5e-7b4a-7c00-8000-000000000011",
  "idempotency_key": "example-insert-001",
  "novel_id": "nov_EUubI",
  "base_revision_id": "rev_x4QZO",
  "expected_head_hash": "sha256:aaaaaaaaaaaaaaaaaaaaaaaaaaaaaaaaaaaaaaaaaaaaaaaaaaaaaaaaaaaaaaaa",
  "type": "insert_blocks",
  "payload": {
    "insertion_point": {
      "scene_id": "scn_I8ENj",
      "position": "end"
    },
    "blocks": [
      {
        "id": "blk_9BvMQ",
        "text": "洛恩推開了門。",
        "meta": {}
      }
    ]
  }
}
